{
  "schema_version": 1,
  "source": "synthetic_provider",
  "producer": "synthetic_connector",
  "mode": "delta",
  "request_id": "synthetic-request-20260815",
  "upsert": [
    {
      "external_id": "public-run-001",
      "name": "河畔晨跑",
      "type": "Run",
      "started_at": "2026-08-10T07:30:00+08:00",
      "duration_seconds": 1880,
      "distance_km": 5.2,
      "average_heartrate_bpm": 142,
      "elevation_gain_m": 12,
      "calories_kcal": 326,
      "is_indoor": false,
      "route_status": "available",
      "summary_polyline": "_p~iF~ps|U_ulLnnqC_mqNvxq`@"
    },
    {
      "external_id": "private-ride-001",
      "name": "Morning Ride",
      "type": "Ride",
      "started_at": "2026-08-11T06:50:00+08:00",
      "duration_seconds": 3520,
      "distance_km": 18.6,
      "average_heartrate_bpm": 126,
      "elevation_gain_m": 86,
      "calories_kcal": 522,
      "is_indoor": false,
      "route_status": "privacy_hidden"
    },
    {
      "external_id": "indoor-stepper-001",
      "type": "StairStepper",
      "started_at": "2026-08-12T19:10:00+08:00",
      "duration_seconds": 1800,
      "distance_km": 0,
      "average_heartrate_bpm": 118,
      "elevation_gain_m": 210,
      "calories_kcal": 245,
      "is_indoor": true,
      "route_status": "unavailable"
    },
    {
      "external_id": "pending-walk-001",
      "name": "Evening Walk",
      "type": "Walk",
      "started_at": "2026-08-13T19:15:00+08:00",
      "duration_seconds": 2460,
      "distance_km": 3.1,
      "average_heartrate_bpm": 104,
      "elevation_gain_m": 5,
      "calories_kcal": 168,
      "is_indoor": false,
      "route_status": "pending"
    }
  ],
  "delete": ["synthetic-deleted-activity"]
}
